Title,Designers,designers-work+url,description,tags+key,styles of play+key
Let's You and Him Flyte,Abe Pressman,"I just created an itch.io! There's nothing on it yet
https://thunderbeard.itch.io/","The world is ending—on this, sources agree. If there is a tomorrow, whether or not you live to see it, it will need new heroes and gods. And so each of you has decided to propose how the world may yet be reborn…if you can convince anyone else.

Let's You and Him Flyte is a game of formalized arguments in the broad style of historical Anglo-Saxon poetry (err, that is, ""ritualized verbal combat""), as a group of survivors debates and competes to see who will save the world, and how.
","medieval, post-apocalyptic, argument, improv","Freeform larp, Larp, Streaming/Online Face to Face"
The Fake Out,Dakota Sky Bloom,"Not sure if this is meant to be a link to the pdf of the game itself. In that case: 
https://drive.google.com/drive/folders/1RpgKYBL-5J5RWWZrJOuOmipMrJdw-p8C?usp=sharing

If it is meant to be a few things I've made, I only have a couple of things published right now, some small jam games. Most of my work has been as campaign larp staff or is in development.
https://dakotaskybloom.itch.io/kilmers-war
https://xthreatgames.itch.io/goblin-maids-by-elm-and-dsb",A tool for dealing with the grief of losing someone you care about.,"Journaling, Playing Cards, Loss, Love","Freeform larp, Tabletop/Pencil & Paper, Journaling"
Exodiplomacy,Susanne Vejdemo & Marshall Bradshaw,http://susanne.vejdemo.se/,"Alien diplomats representing each member civilization in the Interstellar Compact come together to debate Humanity’s application. Each diplomat has different priorities and a different way of communicating those priorities, using patterns of communication found in a variety of real world cultures.","Language, educational, diplomacy, sci-fi","Freeform larp, Larp, Streaming/Online Face to Face, Edularp, Diplomacy Simulation"
The Long Rest,Dan O'Hanlon,,A D&D LARP about the night before a climatic encounter.,"D&D, beginner-friendly, pre-generated chracters","Freeform larp, Larp, Streaming/Online Face to Face"
The Viridians,Piotr Milewski,,"Epistolary freeform sci-fi larp about obligations, legacy and a concept of “home”.","Letters, Dreams, Aliens.","Freeform larp, Pervasive Game/Public Play, Letter Writing, Arts & Crafts"